{
  "history" : [ {
    "drivingStyle" : 45.5,
    "trailerUse" : true,
    "cityDriving" : true,
    "percentage" : 23.5,
    "hilliness" : 75.2,
    "curviness" : 60.0
  } ],
  "vehicleData" : {
    "numberOfDriveAxle" : 2,
    "powerKW" : 145,
    "energySourceCode" : "Unbekannt",
    "vehicleType" : "Limousine",
    "grossVehicleWeightKG" : -1.7976931348623157E308
  },
  "future" : [ {
    "futureScenarioId" : 1,
    "futureScenario" : [ {
      "drivingStyle" : 45.5,
      "cityDriving" : true,
      "trailerUse" : true,
      "curviness" : 60.0,
      "hilliness" : 75.2,
      "percentage" : 23.5
    } ]
  } ],
  "vehicleStatus" : {
    "ageInMonth" : 42,
    "mileage" : 123456
  }
}